{
  "$schema": "../../schemas/release-provenance-record.schema.json",
  "artifacts": [
    {
      "attestation": {
        "status": "verified"
      },
      "kind": "manifest",
      "name": "v0.5.0.json",
      "sha256": "4e0703b0490529bf849def3c42c05a54c2aea44065bfefbb186ea74c6841cda3",
      "source": "https://github.com/hwang595/hpc-skill-hub/blob/v0.5.0/registry/releases/v0.5.0.json"
    },
    {
      "attestation": {
        "status": "verified"
      },
      "kind": "wheel",
      "name": "hpc_skill_hub-0.5.0-py3-none-any.whl",
      "sha256": "f1be01c6f1c168b344a504690632474238d16c7460c4ae02c217a85890e2dd5c",
      "source": "https://github.com/hwang595/hpc-skill-hub/actions/runs/29375502297"
    },
    {
      "attestation": {
        "status": "verified"
      },
      "kind": "sdist",
      "name": "hpc_skill_hub-0.5.0.tar.gz",
      "sha256": "58bb0b3a483bfeb5b8bbacb8b909576b538419362e71d9a11008fed187589a19",
      "source": "https://github.com/hwang595/hpc-skill-hub/actions/runs/29375502297"
    }
  ],
  "commit": "22be6aef66bd07182ce0d0dd67be72d1c2d21522",
  "published_at": "2026-07-14T23:14:13Z",
  "release": "v0.5.0",
  "release_url": "https://github.com/hwang595/hpc-skill-hub/releases/tag/v0.5.0",
  "repository": "hwang595/hpc-skill-hub",
  "schema_version": "0.1.0",
  "tag": "v0.5.0",
  "verification": {
    "method": "gh-attestation-verify",
    "status": "verified",
    "verified_at": "2026-07-14T23:31:04Z"
  },
  "workflow": {
    "completed_at": "2026-07-14T23:14:49Z",
    "conclusion": "success",
    "name": "Package",
    "run_id": 29375502297,
    "run_url": "https://github.com/hwang595/hpc-skill-hub/actions/runs/29375502297"
  }
}
